marketplace,customer_id,review_id,product_id,product_parent,product_title,product_category,star_rating,helpful_votes,total_votes,vine,verified_purchase,review_date
US,19254172,R1KD1GGC6C73FV,B00A8D95OG,477792537,Wahl Professional Animal Deluxe U-Clip Pet Grooming Kit,Pet Products,5.0,709.0,730.0,N,Y,2014-06-04
US,50048341,RU7X8MKRVL6JC,B0009YD7M0,83009018,"X-Mat Original Pet Training Mat, Firm, 18-Inch",Pet Products,2.0,726.0,730.0,N,Y,2012-11-10
US,49679370,R3EFF1WMYK0WGC,B0002C7FHC,715393376,2-Pack PetSafe Basic Bark Control Collar,Pet Products,5.0,697.0,729.0,N,Y,2006-07-03
US,51646510,RS101T76OFUXG,B0014N70QO,226028756,Litter Kwitter Toilet Training System,Pet Products,1.0,680.0,715.0,N,Y,2009-07-04
US,32229612,R2OWU50ZETFI5H,B0009YF4FI,677223497,Tetra Whisper Air Pump (Non-UL),Pet Products,4.0,701.0,714.0,N,N,2011-05-19
US,10826517,RKNYBXNDFYQ66,B004G9L1H2,606779195,Catit Design Senses Food Maze,Pet Products,5.0,706.0,711.0,N,N,2012-02-17
US,15168871,R30U1MA6H4Q1WT,B005AP3B88,528349565,KONG Cozies Dog Squeaky Toy,Pet Products,1.0,662.0,711.0,N,Y,2012-07-11
US,26059364,R2VC15OIL2BT1E,B003NRWKBY,719200895,Rechargeable remote dog training shock and vibration collar for 2 dogs,Pet Products,4.0,702.0,708.0,N,Y,2010-09-30
US,51756495,R2MZGQPGX9NTFV,B000P7JKD6,50243684,Coolaroo Elevated Pet Bed with Knitted Fabric,Pet Products,5.0,691.0,703.0,N,N,2007-09-12
US,22517687,RHUY1PF4WIN34,B004DBNGU8,326535158,Modkat Litter Box with Scoop and Reusable Liner,Pet Products,5.0,679.0,701.0,N,N,2013-03-23
US,30854594,R7CW3REHYEFSB,B003WGGWQA,91529005,Go Pet Club Cat Tree - 72 in.,Pet Products,5.0,696.0,701.0,N,Y,2012-05-04
US,52516622,R1VRQTWYTIYU2M,B007IHY5CM,778426418,"Litter Genie Plus Cat Litter Disposal System with Odor Free Pail System, White",Pet Products,5.0,681.0,699.0,N,N,2012-05-04
US,32981483,R370RL455NCXKA,B001LWRFW2,252131746,"Catit Design Senses Play Circuit, Original",Pet Products,5.0,686.0,697.0,N,N,2009-01-25
US,47152200,R29B3RY4SGQBZI,B004QRJJF0,43509484,Bayer Advantage II Topical Flea Treatment Dogs,Pet Products,5.0,682.0,691.0,N,Y,2015-08-10
US,15491147,RZP5CTRNIJ9WU,B005Z6UNWY,529948569,Novartis Capstar Flea Tablets for Dogs and Cats,Pet Products,5.0,653.0,689.0,N,N,2013-08-02
US,52489317,R1OYAKQ77SOOS1,B00023D368,452829084,"PetSafe Deluxe Bark Control Collar (PDBC-300) for Dogs 8 lb. and Up, Waterproof, 3 Modes of Static Correction",Pet Products,3.0,674.0,686.0,N,Y,2009-01-13
US,19177277,R2ANR5QRPXV2VI,B0017JWARY,405331911,Ideal Pet Products Ruff-Weather Pet Door with Telescoping Frame,Pet Products,5.0,679.0,686.0,N,Y,2012-09-23
US,33075924,R2VNDE0KQ7V1IB,B00CPDWT2M,653274178,Benebone Bacon Wishbone Dog Chew Toy,Pet Products,1.0,653.0,682.0,N,Y,2014-11-09
US,34397745,R2LM2QJW0ZQHC8,B00B8CG602,84647177,"Bayer Seresto Flea and Tick Collar for Dogs, 8 Month Protection",Pet Products,1.0,587.0,678.0,N,N,2014-01-08
US,29157413,R3J7157ABY9IGR,B0081XIJ42,843394534,Outward Hound Kyjen PoochPouch Front Carrier For Dogs Easy-Fit Adjustable Dog Carrier,Pet Products,5.0,650.0,676.0,N,Y,2014-03-26
US,50572923,R207WPWFFGJEB1,B00173CWDW,386723719,SportDOG Rechargeable Bark Control Collar,Pet Products,5.0,643.0,675.0,N,Y,2010-09-16
US,46322379,R26I6EG06XH1SJ,B000LJDLKG,169048113,Litter Robot LRII Automatic Self-Cleaning Litter Box,Pet Products,3.0,633.0,672.0,N,Y,2007-08-17
US,40135606,R1XNELKOCZ9I5C,B00BD3UN8C,604278913,"PetSafe Drinkwell Pagoda Dog and Cat Water Fountain, Ceramic, 70 oz., Carbon Filter",Pet Products,5.0,660.0,670.0,N,Y,2013-05-02
US,43790119,R39TP02KOZK93G,B00CKFL93K,338879043,Rocco & Roxie Professional Strength Stain & Odor Eliminator - Enzyme-Powered Pet Odor & Stain Remover for Dog and Cats Urine,Pet Products,5.0,620.0,668.0,N,Y,2013-11-21
